{
  "$schema": "https://static.modelcontextprotocol.io/schemas/2025-12-11/server.schema.json",
  "description": "EAD Factory MCP — Digital Trust services APIs for your agents",
  "name": "io.github.g-digital-by-Garrigues/ead-factory",
  "packages": [
    {
      "environmentVariables": [
        {
          "description": "Evidence Manager API base URL",
          "isRequired": true,
          "isSecret": false,
          "name": "API_BASE_URL"
        },
        {
          "description": "Full flow base email — used to compose participant emails (user+signatory@domain, etc.)",
          "isRequired": true,
          "isSecret": false,
          "name": "FULL_FLOW_EMAIL_BASE"
        },
        {
          "description": "Full flow default file path",
          "isRequired": true,
          "isSecret": false,
          "name": "FULL_FLOW_FILE_PATH"
        },
        {
          "description": "TCP port for the HTTP transport. Used only when TRANSPORT=http; ignored in stdio mode.",
          "isRequired": true,
          "isSecret": false,
          "name": "HTTP_PORT"
        },
        {
          "description": "Okta application client ID (client_credentials grant).",
          "isRequired": true,
          "isSecret": false,
          "name": "OKTA_CLIENT_ID"
        },
        {
          "description": "Okta application client secret. See https://eadtrust.example.com/onboarding for credential acquisition.",
          "isRequired": true,
          "isSecret": true,
          "name": "OKTA_CLIENT_SECRET"
        },
        {
          "description": "OAuth scope requested. Defaults to 'token' if not provided.",
          "isRequired": true,
          "isSecret": false,
          "name": "OKTA_SCOPE"
        },
        {
          "description": "Okta token endpoint (client_credentials grant). Used both for outbound API calls and for verifying inbound Bearer tokens in HTTP mode.",
          "isRequired": true,
          "isSecret": false,
          "name": "OKTA_TOKEN_URL"
        },
        {
          "description": "Polling interval in milliseconds for the evidence-status check.",
          "isRequired": true,
          "isSecret": false,
          "name": "POLL_INTERVAL_MS"
        },
        {
          "description": "Maximum polling attempts before timing out the evidence-status check.",
          "isRequired": true,
          "isSecret": false,
          "name": "POLL_MAX_ATTEMPTS"
        },
        {
          "description": "Signature Manager API base URL",
          "isRequired": true,
          "isSecret": false,
          "name": "SIGNATURE_API_BASE_URL"
        },
        {
          "description": "Transport: \"stdio\" for local Claude Code, \"http\" for remote deployment with auth",
          "isRequired": true,
          "isSecret": false,
          "name": "TRANSPORT"
        }
      ],
      "identifier": "@g-digital/mcp-ead-factory",
      "registryType": "npm",
      "transport": {
        "type": "stdio"
      },
      "version": "1.0.3"
    }
  ],
  "repository": {
    "source": "github",
    "url": "https://github.com/g-digital-by-Garrigues/MCP_Market_Distribution"
  },
  "version": "1.0.3"
}
